{
    "name": "Ripple",
    "symbol": "XRP",
    "website": "https://ripple.com",
    "blockchain_explorer": [
        "https://xrpcharts.ripple.com/#/graph/ ",
        "https://bithomp.com/explorer/",
        "https://ripple.com/build/data-api-tool/"
    ],
    "nodes_explorer": [],
    "message_board": "https://www.xrpchat.com",
    "twitter": "https://twitter.com/Ripple ",
    "reddit": "https://www.reddit.com/r/Ripple/",
    "repo": "https://github.com/ripple/rippled",
    "whitepaper": "http://www.ghassankarame.com/ripple.pdf",
    "max_supply": "100B",
    "genesis_block_date": "2013-01-01",
    "proof_type": "NA",
    "hash_algo": "SHA-512Half",
    "block_time": 4,
    "block_size": "Inf",
    "block_reward": "NA",
    "anonymous": false,
    "tx_per_second": 1000,
    "core_lang": "C++",
    "masternode": false,
    "masternode_supply": "NA",
    "smart_contracts": false,
    "lightning_network": false
}
